{
  "code": "IN",
  "version": 2,
  "effective_from": "2026-10-10",
  "name": "India",
  "locale": "en-IN",
  "currency": {
    "code": "INR",
    "minor_unit": 2,
    "symbol": "₹"
  },
  "fy_start_month": 4,
  "timezones": [
    "Asia/Kolkata"
  ],
  "default_timezone": "Asia/Kolkata",
  "formats": {
    "number_grouping": "indian",
    "decimal_separator": ".",
    "group_separator": ",",
    "date": "dd/MM/yyyy",
    "magnitude_words": [
      {
        "word": "thousand",
        "suffix": "k",
        "exponent": 3
      },
      {
        "word": "lakh",
        "suffix": "L",
        "exponent": 5
      },
      {
        "word": "crore",
        "suffix": "Cr",
        "exponent": 7
      }
    ]
  },
  "tax": {
    "regime": "gst_in",
    "price_display": "exclusive",
    "rounding": "half_up_per_line",
    "default_class": "restaurant_5",
    "classes": [
      {
        "code": "restaurant_5",
        "label": "GST 5% (restaurant service, no input tax credit)",
        "rate_bp": 500,
        "components": [
          {
            "code": "CGST",
            "rate_bp": 250
          },
          {
            "code": "SGST",
            "rate_bp": 250
          }
        ],
        "input_tax_credit": false,
        "supply": "service",
        "applies_to": "Restaurant service, including takeaway and own delivery, outside specified premises"
      },
      {
        "code": "restaurant_specified_premises_18",
        "label": "GST 18% (restaurant in specified premises, with input tax credit)",
        "rate_bp": 1800,
        "components": [
          {
            "code": "CGST",
            "rate_bp": 900
          },
          {
            "code": "SGST",
            "rate_bp": 900
          }
        ],
        "input_tax_credit": true,
        "supply": "service",
        "applies_to": "Restaurant service in specified premises (hotel premises above the notified room-tariff threshold)",
        "_unverified": [
          "R21 lists GST IN 5%/18%; the specified-premises class and its room-tariff threshold were not re-read against a primary source in T-002"
        ]
      },
      {
        "code": "goods_exempt",
        "label": "Nil-rated / exempt goods",
        "rate_bp": 0,
        "components": [],
        "input_tax_credit": true,
        "supply": "goods",
        "applies_to": "Shop items with no GST (e.g. unpackaged fresh produce)",
        "_unverified": [
          "Which goods are nil-rated or exempt was not researched; the class exists so a shop can mark items"
        ]
      },
      {
        "code": "goods_5",
        "label": "GST 5% (goods)",
        "rate_bp": 500,
        "components": [
          {
            "code": "CGST",
            "rate_bp": 250
          },
          {
            "code": "SGST",
            "rate_bp": 250
          }
        ],
        "input_tax_credit": true,
        "supply": "goods",
        "applies_to": "Shop items in the 5% slab, chosen per item"
      },
      {
        "code": "goods_12",
        "label": "GST 12% (goods)",
        "rate_bp": 1200,
        "components": [
          {
            "code": "CGST",
            "rate_bp": 600
          },
          {
            "code": "SGST",
            "rate_bp": 600
          }
        ],
        "input_tax_credit": true,
        "supply": "goods",
        "applies_to": "Shop items in the 12% slab, chosen per item",
        "_unverified": [
          "The September 2025 GST rate rationalisation was reported to fold most 12% goods into 5% or 18%; whether a 12% goods slab still applies to any item was not verified. Kept as data so an item can carry it if it does"
        ]
      },
      {
        "code": "goods_18",
        "label": "GST 18% (goods)",
        "rate_bp": 1800,
        "components": [
          {
            "code": "CGST",
            "rate_bp": 900
          },
          {
            "code": "SGST",
            "rate_bp": 900
          }
        ],
        "input_tax_credit": true,
        "supply": "goods",
        "applies_to": "Shop items in the 18% slab, chosen per item"
      }
    ],
    "_unverified": [
      "price_display \"exclusive\" (GST added on the bill) is common restaurant practice, not a sourced rule; packaged goods carry an MRP that is tax-inclusive",
      "Intra-state CGST+SGST split only; IGST for inter-state supply is not modelled",
      "Per-item goods slabs are data chosen by the merchant; the pack does not map HSN codes to slabs"
    ]
  },
  "tax_ids": [
    {
      "code": "GSTIN",
      "label": "GSTIN",
      "pattern": "^[0-9]{2}[A-Z]{5}[0-9]{4}[A-Z][1-9A-Z]Z[0-9A-Z]$",
      "holder": "outlet",
      "required": true,
      "on_receipt": true,
      "receipt_field": "gstin",
      "_unverified": [
        "GST registration turnover thresholds are not modelled; the pack assumes a registered business"
      ]
    },
    {
      "code": "FSSAI",
      "label": "FSSAI Lic. No.",
      "pattern": "^[0-9]{14}$",
      "holder": "outlet",
      "required": true,
      "on_receipt": true,
      "receipt_field": "fssai_number"
    }
  ],
  "invoice": {
    "title": "Tax Invoice",
    "every_receipt_is_tax_invoice": true,
    "required_fields": [
      "seller_name",
      "seller_address",
      "gstin",
      "fssai_number",
      "invoice_no",
      "invoice_date",
      "items",
      "taxable_value",
      "tax_components",
      "total"
    ],
    "buyer_identity_above_minor": null,
    "_unverified": [
      "Exact GST invoice field list (e.g. SAC code, place of supply) not re-read against the CGST Rules",
      "Buyer details threshold for B2C invoices not modelled"
    ]
  },
  "printed_price": {
    "rule": "sale_above_mrp_refused",
    "applies_to": "Packaged goods sold by a shop that carry a printed MRP (maximum retail price, inclusive of all taxes)",
    "_unverified": [
      "The MRP rule follows the Legal Metrology (Packaged Commodities) Rules as commonly applied; exceptions (e.g. restaurant service of packaged drinks) were not researched"
    ]
  },
  "aggregators": [
    {
      "code": "swiggy",
      "display_name": "Swiggy",
      "import_format": "swiggy_orders_v1",
      "tax_treatment": "operator_collects_excluded",
      "legal_basis": "CGST Act Sec 9(5): GST on restaurant service supplied through an electronic commerce operator is paid by the operator",
      "_unverified": [
        "Statement format is Swiggy/Zomato-shaped synthetic data, not the operators’ actual export layout"
      ]
    },
    {
      "code": "zomato",
      "display_name": "Zomato",
      "import_format": "zomato_orders_v1",
      "tax_treatment": "operator_collects_excluded",
      "legal_basis": "CGST Act Sec 9(5): GST on restaurant service supplied through an electronic commerce operator is paid by the operator",
      "_unverified": [
        "Statement format is Swiggy/Zomato-shaped synthetic data, not the operators’ actual export layout"
      ]
    }
  ],
  "payroll_scope": "drafts",
  "surcharges": {
    "card_surcharge": "not_applicable",
    "_unverified": [
      "No surcharge rule is modelled for IN; card-network and RBI positions on surcharging were not researched"
    ]
  },
  "compliance_calendar": [
    {
      "code": "gst.gstr1",
      "label": "GSTR-1 (outward supplies)",
      "recurrence": "monthly",
      "due_day_after_period": 11,
      "_unverified": [
        "Due day and the quarterly (QRMP) option not re-read against the GST portal"
      ]
    },
    {
      "code": "gst.gstr3b",
      "label": "GSTR-3B (summary return and payment)",
      "recurrence": "monthly",
      "due_day_after_period": 20,
      "_unverified": [
        "Due day and the quarterly (QRMP) option not re-read against the GST portal"
      ]
    },
    {
      "code": "fssai.licence_details",
      "label": "FSSAI licence details current on every bill",
      "recurrence": "on_change",
      "due_day_after_period": null
    }
  ],
  "licence_kinds": [
    {
      "code": "fssai",
      "label": "FSSAI licence / registration",
      "holder": "outlet",
      "outlet_kinds": [
        "restaurant",
        "cloud_kitchen",
        "store"
      ]
    },
    {
      "code": "gst",
      "label": "GST registration",
      "holder": "business",
      "outlet_kinds": [
        "restaurant",
        "cloud_kitchen",
        "store"
      ],
      "_unverified": [
        "Registration is turnover-dependent; the pack treats it as tracked for every business"
      ]
    },
    {
      "code": "trade_licence",
      "label": "Trade licence (municipal)",
      "holder": "outlet",
      "outlet_kinds": [
        "restaurant",
        "cloud_kitchen",
        "store"
      ],
      "_unverified": [
        "Name, issuer and renewal period vary by municipality"
      ]
    },
    {
      "code": "fire_noc",
      "label": "Fire NOC",
      "holder": "outlet",
      "outlet_kinds": [
        "restaurant",
        "cloud_kitchen"
      ],
      "_unverified": [
        "Applicability depends on state rules, seating and floor area; shops not modelled"
      ]
    },
    {
      "code": "shops_establishment",
      "label": "Shops and Establishments registration",
      "holder": "outlet",
      "outlet_kinds": [
        "restaurant",
        "cloud_kitchen",
        "store"
      ],
      "_unverified": [
        "State-specific Act; renewal periods differ by state"
      ]
    }
  ],
  "expired_sale_override": false,
  "status_channels": [
    "in_app"
  ],
  "cash_rounding_minor": 100,
  "severity_ladder": {
    "critical_minor_gte": 5000000,
    "high_minor_gte": 1000000,
    "medium_minor_gte": 200000,
    "_notes": [
      "INFERENCE: severity ladder L from the docs/plan/packs header (₹50,000 / ₹10,000 / ₹2,000; A$1,000 / A$200 / A$40 of monthly impact)"
    ]
  },
  "detectors": {
    "catalogue.negative_margin": {
      "thresholds": {
        "margin_minor_lt": 0,
        "units_sold_gte": 20,
        "window_days": 14,
        "high_units_rank_lte": 10